{
  "schema_version": "forensix/key-material-record/1",
  "record_id": "linux-libsecret-v11-1",
  "capture_state": "captured",
  "key_kind": "oscrypt_row_key",
  "usable_row_key": true,
  "provider": {
    "platform": "linux",
    "name": "gnome-libsecret",
    "item": "Chrome Safe Storage",
    "scope": "live_account_session"
  },
  "context": [
    {
      "name": "application",
      "value": "chrome"
    },
    {
      "name": "derivation",
      "value": "pbkdf2-hmac-sha1"
    },
    {
      "name": "iterations",
      "value": "1"
    },
    {
      "name": "salt",
      "value": "saltysalt"
    }
  ],
  "policy": {
    "row_prefix": "v11",
    "support": "supported"
  },
  "evidence": [],
  "sealed_material": {
    "algorithm": "x25519-hkdf-sha256-aes-256-gcm",
    "recipient_fingerprint": "sha256:d19bf3f082782c87b783fe7134698aeff6e66d9f86afaf7cf9e9b8bf40bab3ff",
    "ephemeral_public_key": "sNCPNbRoM4FImvsygl5ZFS1H0ZvJ4FDW1alUmEydHiw=",
    "salt": "WlpaWlpaWlpaWlpaWlpaWlpaWlpaWlpaWlpaWlpaWlo=",
    "nonce": "WlpaWlpaWlpaWlpa",
    "ciphertext": "e1TD0+O4niysMGh/qDekb7wNcZPOmYKbNL2GTlMKAXE=",
    "associated_data_sha256": "a1e4dc106adf84c9ddcdfee681156ea8befade916c247d83748d8f0d1ea35d33"
  }
}
